title,price,location,time,status,seller_nickname,description,image_count,chat_count,interest_count,view_count,manner_temperature,url
블랙 니트(F),"8,000원",대전 서구 둔산동,끌올 1시간 전,판매중,호롤롤롤롤,사이즈  F 총장 62 어깨 61 소매 48 가슴 55 🌝비대면 문고리 거래🌝 🌝선입금 확인 후 주소 보내드려요🌝 🌝환불 불가🌝,9,0,2,276,46.3°C,https://www.daangn.com/kr/buy-sell/%EB%B8%94%EB%9E%99-%EB%8B%88%ED%8A%B8-f-2zfynntc59fw/
검정색 플리츠 미니스커트 치마 F,"8,000원",대전 서구 둔산동,끌올 1시간 전,판매중,호롤롤롤롤,사이즈  F 총장 40 허리32 엉덩이44 🌝비대면 문고리 거래🌝 🌝선입금 확인 후 주소 보내드려요🌝 🌝환불 불가🌝,6,1,6,202,46.3°C,https://www.daangn.com/kr/buy-sell/%EA%B2%80%EC%A0%95%EC%83%89-%ED%94%8C%EB%A6%AC%EC%B8%A0-%EB%AF%B8%EB%8B%88%EC%8A%A4%EC%BB%A4%ED%8A%B8-%EC%B9%98%EB%A7%88-f-6uuz9zdobvf6/
삼성 64GB PC4-2666 서버램 메모리 DDR4 ECC 4개 남 일괄 190만원,"500,000원",대전 서구 둔산동,끌올 1시간 전,판매중,kimjang,"삼성 64GB PC4-2666V-L 4DRx4 ECC  서버용 메모리입니다 개인 서버/워크스테이션 업그레이드 탈착 제품입니다  4개  남았습니다 개당 500,000 만원 일괄시 190만원 더이상 네고 안받습니다.  택배시 우체국 착불",6,0,4,132,37.6°C,https://www.daangn.com/kr/buy-sell/%EC%82%BC%EC%84%B1-64gb-pc4-2666-%EC%84%9C%EB%B2%84%EB%9E%A8-%EB%A9%94%EB%AA%A8%EB%A6%AC-ddr4-ecc-4%EA%B0%9C-%EB%82%A8-%EC%9D%BC%EA%B4%84-190%EB%A7%8C%EC%9B%90-7nnap2yx137r/
루이비통 스피디30,"500,000원",대전 서구 둔산동,끌올 1시간 전,판매중,qwerasdf,루이비통 스피디 30 상태 좋아요 루이비통 매장에서 구매했고 사진 보시면 증명서 있습니다,8,0,29,530,36.9°C,https://www.daangn.com/kr/buy-sell/%EB%A3%A8%EC%9D%B4%EB%B9%84%ED%86%B5-%EC%8A%A4%ED%94%BC%EB%94%9430-zromamf3o5m5/
BON 남성 네이비 블레이저,"35,000원",대전 서구 둔산동,1시간 전,판매중,다이버,"BON 남성 정장 set입니다 색상은 네이비(블루빛이 나기도 해요)이며, 스트레치 기능이 있어 편안하게 착용 가능합니다  상태는 매우 양호합니다살이 쪄서 바지가 너무 타이트해져판매합니다 간절기와 겨울에도 착용가능한 BON 제품이고 사이즈는 상의(100),하의(78)-허리30에 해당하고 슬림핏이니 참고하세요 중고 제품특성상 반품은 어렵습니다",7,0,0,8,39.1°C,https://www.daangn.com/kr/buy-sell/bon-%EB%82%A8%EC%84%B1-%EB%84%A4%EC%9D%B4%EB%B9%84-%EB%B8%94%EB%A0%88%EC%9D%B4%EC%A0%80-4tc1qjxkz7bo/
오아 아이브릭 미니 블루투스 스피커,"13,000원",대전 서구 월평동,끌올 1시간 전,판매중,안녕하세요,사용감 조금 있는 정도 입니다 크기에 비해 소리 크고 휴대용 으로 가지고 다니기 편해요,10,0,7,194,49.8°C,https://www.daangn.com/kr/buy-sell/%EC%98%A4%EC%95%84-%EC%95%84%EC%9D%B4%EB%B8%8C%EB%A6%AD-%EB%AF%B8%EB%8B%88-%EB%B8%94%EB%A3%A8%ED%88%AC%EC%8A%A4-%EC%8A%A4%ED%94%BC%EC%BB%A4-ehckhkavgphd/
나무 팔레트 나눔합니다,나눔,대전 서구 둔산동,1시간 전,판매중,롸라,나무 팔레트입니다 일괄로 가져가실수 있는분께 나눔합니다 직접 오셔서 가져가셔야돼요,8,0,0,27,39.5°C,https://www.daangn.com/kr/buy-sell/%EB%82%98%EB%AC%B4-%ED%8C%94%EB%A0%88%ED%8A%B8-%EB%82%98%EB%88%94%ED%95%A9%EB%8B%88%EB%8B%A4-qzpudi5g8usd/
[자급제/미개봉] 아이폰17프로맥스 전색상 판매합니다,"1,920,000원",대전 서구 둔산동,끌올 1시간 전,판매중,직거래만,"개봉하지 않은 미개봉 새상품입니다 통신사제품이 아닌 자급제입니다. 애플공식샵에서 구매한제품입니다. 기종 : 아이폰17프로맥스 용량 : 256G 구매가능색상 : 오렌지192, 블루193, 실버195 상태 : 개봉하지 않은 완전새제품 통신사,알뜰폰 상관없이 유심만넣고 바로 사용하시면 됩니다 네고는 불가합니다 선물용으로도 가능합니다 현금인출거래합니다 계좌이체 195, 196, 198만원 안팔리면 업체넘깁니다 품절시 글내립니다",6,11,5,358,39.7°C,https://www.daangn.com/kr/buy-sell/%EC%9E%90%EA%B8%89%EC%A0%9C-%EB%AF%B8%EA%B0%9C%EB%B4%89-%EC%95%84%EC%9D%B4%ED%8F%B017%ED%94%84%EB%A1%9C%EB%A7%A5%EC%8A%A4-%EC%A0%84%EC%83%89%EC%83%81-%ED%8C%90%EB%A7%A4%ED%95%A9%EB%8B%88%EB%8B%A4-2hhans63x3rg/
"[자급제/미개봉] 아이폰17 화이트,블랙 판매합니다","1,140,000원",대전 서구 둔산동,끌올 1시간 전,판매중,직거래만,"개봉하지 않은 미개봉 새상품입니다 통신사제품이 아닌 자급제입니다. 애플공식샵에서 구매한제품입니다. 기종 : 아이폰17 용량 : 256G 구매가능색상 : 화이트, 블랙 상태 : 개봉하지 않은 완전새제품 통신사,알뜰폰 상관없이 유심만넣고 바로 사용하시면 됩니다 네고는 불가합니다 선물용으로도 가능합니다 현금인출거래합니다 계좌이체 117만원 안팔리면 업체넘깁니다",8,22,33,1585,39.7°C,https://www.daangn.com/kr/buy-sell/%EC%9E%90%EA%B8%89%EC%A0%9C-%EB%AF%B8%EA%B0%9C%EB%B4%89-%EC%95%84%EC%9D%B4%ED%8F%B017-%ED%99%94%EC%9D%B4%ED%8A%B8-%EB%B8%94%EB%9E%99-%ED%8C%90%EB%A7%A4%ED%95%A9%EB%8B%88%EB%8B%A4-pdcioriebtkv/
아큐브 오아시스 1회용 렌즈,"20,000원",대전 서구 둔산동,2시간 전,판매중,secret,"한쪽 30개들이 한상자에서 5개 쓰고 오른쪽 25개 ,왼쪽 25개 남았어요. 도수는 사진 참고해주세요  둘다 2만원에 드립니다  GS나 CU 반값 택배로도 보내드릴 수 있습니다",5,0,0,5,56.6°C,https://www.daangn.com/kr/buy-sell/%EC%95%84%ED%81%90%EB%B8%8C-%EC%98%A4%EC%95%84%EC%8B%9C%EC%8A%A4-1%ED%9A%8C%EC%9A%A9-%EB%A0%8C%EC%A6%88-ba3m83fnqu7i/
[ 유아도서 ] 오감톡톡 자연관찰 도서,"9,000원",대전 중구 산성동,끌올 2시간 전,판매중,래미,글뿌리 오감톡톡 자연관찰 도서입니다 아이들이 자연을 쉽고 재미있게 배울 수 있도록 도와줍니다 사진에서 보시는 것처럼 몇 권 없습니다.  _ 예민하신 분 사절 ❌️,5,0,4,127,42.6°C,https://www.daangn.com/kr/buy-sell/%EC%9C%A0%EC%95%84%EB%8F%84%EC%84%9C-%EC%98%A4%EA%B0%90%ED%86%A1%ED%86%A1-%EC%9E%90%EC%97%B0%EA%B4%80%EC%B0%B0-%EB%8F%84%EC%84%9C-1ckzj1e16yez/
어성초+유황 천연 수제 비누 수녀원판매,"7,000원",대전 서구 둔산동,끌올 2시간 전,판매중,푸딩,어성초와 유황으로 만든 천연 수제 비누입니다 포장된 상태로 드립니다 2개 가격 입니다,5,0,4,76,39.0°C,https://www.daangn.com/kr/buy-sell/%EC%96%B4%EC%84%B1%EC%B4%88-%EC%9C%A0%ED%99%A9-%EC%B2%9C%EC%97%B0-%EC%88%98%EC%A0%9C-%EB%B9%84%EB%88%84-%EC%88%98%EB%85%80%EC%9B%90%ED%8C%90%EB%A7%A4-z95d53t32qce/
큰 전신 거울 (문걸이용가능),"18,000원",대전 서구 둔산동,끌올 2시간 전,판매중,평화를빕니다,전신 거울입니다 문에 걸어서 사용하는 형태입니다 흰색프레임이 있어 깔끔합니다 키가커서 큰거울찾았는데  이 거울은 사이즈가 커서 한눈에 전신이 다 보여 시원~합니다. 거는 부분 높이조절가능합니다  상세사이즈는 사진 참고하세요 35900에 구매하여 첫구매자입니다.(중고x) 비대면o 선입금o  당근페이o 계좌이체o 환불반품x 둔산1동입니다,8,0,10,145,43.2°C,https://www.daangn.com/kr/buy-sell/%ED%81%B0-%EC%A0%84%EC%8B%A0-%EA%B1%B0%EC%9A%B8-%EB%AC%B8%EA%B1%B8%EC%9D%B4%EC%9A%A9%EA%B0%80%EB%8A%A5-88ookfhnp91s/
해외수입품) 플랩잭키즈 유치원 유아 아동 여아 양면 벙거지 모자 2개,"10,000원",대전 서구 둔산동,끌올 2시간 전,판매중,평화를빕니다,"Flap jack kids 플랩잭키즈 유아용 양면 벙거지 모자 두개 입니다 다양한 디자인으로 양면 착용이 가능하고 턱에 벨크로도있어 바람에 날라가지않아 활용도가 높아요. 부드럽지만 튼튼한 면 재질입니다. 4세부터 초등입학전 7세까지 잘 썼습니다. 공작새, 부엉이, 말 등 귀여운 캐릭터와 'Be-you-tiful' 같은 문구가 있어 아이들이 좋아할 거예요 햇빛 차단은 물론 스타일 연출에도 좋은 아이템입니다 전반적으로 깨끗하고 상태 양호합니다.",11,0,1,18,43.2°C,https://www.daangn.com/kr/buy-sell/%ED%95%B4%EC%99%B8%EC%88%98%EC%9E%85%ED%92%88-%ED%94%8C%EB%9E%A9%EC%9E%AD%ED%82%A4%EC%A6%88-%EC%9C%A0%EC%B9%98%EC%9B%90-%EC%9C%A0%EC%95%84-%EC%95%84%EB%8F%99-%EC%97%AC%EC%95%84-%EC%96%91%EB%A9%B4-%EB%B2%99%EA%B1%B0%EC%A7%80-%EB%AA%A8%EC%9E%90-2%EA%B0%9C-ai3i6te4o88z/
겨울왕국 엘사 어린이 자전거,"43,000원",대전 서구 둔산동,끌올 2시간 전,판매중,평화를빕니다,"겨울왕국 디자인의 아동용 자전거입니다 앞바구니와 딸랑이가 달려있어 아이들이 좋아할 만한 디자인이에요 파스텔톤 색상이 예쁘고, 아이들이 타기에 안전한 구조로 되어있습니다 보조바퀴도 있습니다.",5,0,1,134,43.2°C,https://www.daangn.com/kr/buy-sell/%EA%B2%A8%EC%9A%B8%EC%99%95%EA%B5%AD-%EC%97%98%EC%82%AC-%EC%96%B4%EB%A6%B0%EC%9D%B4-%EC%9E%90%EC%A0%84%EA%B1%B0-pv5wettbm2h9/
여아 발레복 세트 튜튜 슈즈 가디건 타이즈 가방 일괄 초등,"50,000원",대전 서구 둔산동,끌올 2시간 전,판매중,평화를빕니다,"여자아이 발레복 세트입니다 발레복 모두 국산. 발레복 13호만 벌당 4만원대 구매하고  기타는 벌당 7-8만원 이상 주고 샀습니다. - 핑크색 튜튜 분리형 (5-9호, 타이즈 있음,사진착샷) - 핑크색 튜튜 일체형+ 기디건 (4-5세용 15-17kg, 타이즈있음) - 핑크색 발레복 1벌 (초등2-4학년 13호) 30kg까지 - 검정색 발레복 1벌 (초등2-4학년13호) 30kg까지 - 발레 슈즈 3켤레 (170mm, 215mm, 230mm)  - 발레가방 타이즈는 제일 쉽게 닳는 소모품입니다. 같이 드리지만 새로도 사서 신겨주세요. 얼마안합니다 다양한 구성으로 발레를 시작하는 아이에게 적합하며, 자매가 여러 벌을 번갈아 입히기 좋습니다 신발상태도 너무좋고요. 신발 값만해도 거저입니다… 일괄거래희망합니다.",7,2,17,301,43.2°C,https://www.daangn.com/kr/buy-sell/%EC%97%AC%EC%95%84-%EB%B0%9C%EB%A0%88%EB%B3%B5-%EC%84%B8%ED%8A%B8-%ED%8A%9C%ED%8A%9C-%EC%8A%88%EC%A6%88-%EA%B0%80%EB%94%94%EA%B1%B4-%ED%83%80%EC%9D%B4%EC%A6%88-%EA%B0%80%EB%B0%A9-%EC%9D%BC%EA%B4%84-%EC%B4%88%EB%93%B1-na9b6v8ssvhy/
절판 재출판) 계몽사 어린이 세계의 명작 전집 15권,"100,000원",대전 서구 둔산동,끌올 2시간 전,판매중,평화를빕니다,"새책으로 사서 여아둘이 읽혔습니다. 아름답고 신비로운 삽화가 상상력을 북돋아줍니다. 저도 어릴적 재밌게 읽었던 책이었는데 아이들에게도 읽히고싶어서 구매하고싶었지만 절판되어서 어렵게 구한책입니다. 총 15권으로 구성되어 있습니다. 상태는 아주아주양호합니,",5,0,6,199,43.2°C,https://www.daangn.com/kr/buy-sell/%EC%A0%88%ED%8C%90-%EC%9E%AC%EC%B6%9C%ED%8C%90-%EA%B3%84%EB%AA%BD%EC%82%AC-%EC%96%B4%EB%A6%B0%EC%9D%B4-%EC%84%B8%EA%B3%84%EC%9D%98-%EB%AA%85%EC%9E%91-%EC%A0%84%EC%A7%91-15%EA%B6%8C-s79nh3m9dfbn/
"더이상가격조정x) 닌텐도wii 풀세트 정품케이스,정품 팩 포함","90,000원",대전 서구 둔산동,끌올 2시간 전,판매중,평화를빕니다,"신상품으로 구매해서 잘보관 한 상품입니다. 사진속 제품 모두 포함. 바로 설치해서 사용가능. 정품설명서 일괄 cd 리더 본체, 전원 어댑터 본체 거치대(과열방지, 구성 외 별도구매) 모션 유선 센서바 모션 무선 센서바 리모컨1ea, (한개는 있으나 고장, 함께드림) 정품 리모컨 보호 실리콘케이스 2ea,  눈차크2ea,  wii스포츠 옵션장비 (골프, 테니스,야구) 글러브 한쌍,  wii fit 보드  wii fit 밸러스 센서조절 부품4ea 스위치 component(tv연결 커넥터, 별도 구매) 정품 팩 가방 정품 팩 4종+ 포함입니다. -No more heros  -Tigerwoods PGA tour -Wii fit -Wii sport -처음 만나는 wii 글러브는 가죽 특성으로 자연 노후화 되는 부분이 있습니다(마지막 사진 참고) 리모컨 하나는 보관도중 오래된 건전지로 인해 파손되었습니다.  당근에 올리기전에 연결해서 모두 이상 유무 확인했습니다.  미리 언급해드린 부분외에는 다른 이상 일절없으니 반품 환불은 불가합니다. (동영상 촬영해둠, 불량이거나 안되는거 없음)",13,0,14,476,43.2°C,https://www.daangn.com/kr/buy-sell/%EB%8D%94%EC%9D%B4%EC%83%81%EA%B0%80%EA%B2%A9%EC%A1%B0%EC%A0%95x-%EB%8B%8C%ED%85%90%EB%8F%84wii-%ED%92%80%EC%84%B8%ED%8A%B8-%EC%A0%95%ED%92%88%EC%BC%80%EC%9D%B4%EC%8A%A4-%EC%A0%95%ED%92%88-%ED%8C%A9-%ED%8F%AC%ED%95%A8-mrqcupt1ay3a/
테일러메이드 p770 4번아이언(드라이빙아이언),"165,000원",대전 대덕구 중리동,끌올 2시간 전,판매중,당근최고,"테일러메이드 코리아 정품  P770 4번 아이언 단품입니다 중공구조라  비거리 좋고  드라이빙 아이언 생각하심 됩니다 샤프트는 Dynamic Gold EX Tour Issue S200 이고, 그립은 Golf Pride 제품입니다 P770 아이언은 관용성이 뛰어나고 타구감이 좋다는 평이 많습니다 시타가능 01071849292 전화주시고  쿨거래시  쿨네고  해드립니다",10,1,5,266,40.7°C,https://www.daangn.com/kr/buy-sell/%ED%85%8C%EC%9D%BC%EB%9F%AC%EB%A9%94%EC%9D%B4%EB%93%9C-p770-4%EB%B2%88%EC%95%84%EC%9D%B4%EC%96%B8-%EB%93%9C%EB%9D%BC%EC%9D%B4%EB%B9%99%EC%95%84%EC%9D%B4%EC%96%B8-nudi9jebmth3/
미즈노 아이언 & 골프 세트 (타이틀 드라이버포함),"399,000원",대전 대덕구 중리동,끌올 2시간 전,판매중,당근최고,미즈노 아이언과 닉 프라이스 골프백 풀세트입니다 - 아이언은 COMP EZ T-ZOID 모델입니다 - 드라이버는 Titleist 915 D3 모델입니다 골프채 풀세트로 구성되어 있어 필드 라운딩에 바로 사용 가능합니다 드라이버 ㆍ우드 ㆍ유틸  ㆍ아이언세트ㆍ웨지세트 ㆍ퍼터  ㆍ캐디백 까지 모두 포함입니다    01071849292  구입문의 전화주세요,12,0,4,540,40.7°C,https://www.daangn.com/kr/buy-sell/%EB%AF%B8%EC%A6%88%EB%85%B8-%EC%95%84%EC%9D%B4%EC%96%B8-%EA%B3%A8%ED%94%84-%EC%84%B8%ED%8A%B8-%ED%83%80%EC%9D%B4%ED%8B%80-%EB%93%9C%EB%9D%BC%EC%9D%B4%EB%B2%84%ED%8F%AC%ED%95%A8-te1xth6sx2qb/
미니바이올렛 아이리쉬엔젤,"6,000원",대전 서구 둔산동,끌올 2시간 전,판매중,딩가,꽃대가 많이 올라오는 중이에요. 화분 : 지름 8cm,10,0,9,149,90.9°C,https://www.daangn.com/kr/buy-sell/%EB%AF%B8%EB%8B%88%EB%B0%94%EC%9D%B4%EC%98%AC%EB%A0%9B-%EC%95%84%EC%9D%B4%EB%A6%AC%EC%89%AC%EC%97%94%EC%A0%A4-wyfo31hb41to/
남성골프세트,"299,000원",충북 청주시 흥덕구 가경동,끌올 2시간 전,판매중,당근YG,핑드라이버   테일러메이드우드  3번 5번  7번(4번유틸 대체) 아담스 아이언5 6  7  8  9  p  s 전체  그라파이트  (카본)샤프트  R플렉스 us스펙  입니다   아시아스펙 sr플렉스  보심됩니다   시타도  가능합니다  퍼터  ㆍ캐대백  전화주시고  쿨거래시  쿨네고  가능 01071849292,7,0,0,221,37.5°C,https://www.daangn.com/kr/buy-sell/%EB%82%A8%EC%84%B1%EA%B3%A8%ED%94%84%EC%84%B8%ED%8A%B8-d7z8b95v2jn1/
베고니아 스노우플렉스,"5,000원",대전 서구 둔산동,끌올 2시간 전,판매중,캐모마일,멋진 베고니아 입니다  자리부족으로 저렴히 올려요  사이즈는 종이컵과 비교해주세요  비대면거래 합니다,8,0,4,183,78.6°C,https://www.daangn.com/kr/buy-sell/%EB%B2%A0%EA%B3%A0%EB%8B%88%EC%95%84-%EC%8A%A4%EB%85%B8%EC%9A%B0%ED%94%8C%EB%A0%89%EC%8A%A4-aijvca33ry4t/
베고니아 월궁전,"6,000원",대전 서구 둔산동,끌올 2시간 전,판매중,캐모마일,베고니아 월궁전입니다.  꽃이 피면 큼직하고 예쁩니다. 마지막 사진은 모체에서 예쁘게 피었을때 모습입니다. 비대면 거래 합니다.,9,0,5,246,78.6°C,https://www.daangn.com/kr/buy-sell/%EB%B2%A0%EA%B3%A0%EB%8B%88%EC%95%84-%EC%9B%94%EA%B6%81%EC%A0%84-8498ujy66adi/
베고니아 아르젠티오굿타타,"5,000원",대전 서구 둔산동,끌올 2시간 전,판매중,캐모마일,예쁘고 순하게 자라는 베고니아 입니다. 두개 있는데 각 5천원 입니다. 사이즈는 종이컵과 비교해주세요. 비대면 거래 합니다.,9,1,12,328,78.6°C,https://www.daangn.com/kr/buy-sell/%EB%B2%A0%EA%B3%A0%EB%8B%88%EC%95%84-%EC%95%84%EB%A5%B4%EC%A0%A0%ED%8B%B0%EC%98%A4%EA%B5%BF%ED%83%80%ED%83%80-zykxeg6pab8d/
미바 미드나잇썬,"6,000원",대전 서구 둔산동,끌올 2시간 전,판매중,캐모마일,우아한 짙은 버건디빛 겹꽃이 핍니다. 이제 꽃 피우기 시작이니 한참동안 꽃을 보실거에요. 7cm 연질화분에서 자라고 있습니다. 비대면거래 합니다.,6,0,7,418,78.6°C,https://www.daangn.com/kr/buy-sell/%EB%AF%B8%EB%B0%94-%EB%AF%B8%EB%93%9C%EB%82%98%EC%9E%87%EC%8D%AC-117rzxnqct1v/
야마하cs 골프채 풀세트,"999,000원",충북 청주시 흥덕구 가경동,끌올 2시간 전,판매중,당근YG,"야마하 Inpres 골프채 풀세트 판매합니다 일본제조   ㆍ 정품 국내as가능   작스 우드 4번7번은  미사용 신품입니다 - 구성: 드라이버, 우드4번,7번(4번유틸리티 대용), 아이언56789pas  - 퍼터는 Odyssey Crimson Series 550 모델입니다 - 골프백은 Master Bunny Edition 입니다   (파리게이츠 한정판 힐캐디백)  골프백 신품구입시  약 100만원 이었습니다 위  구성 세트면  추가 필요한 클럽없습니다 초보부터  싱글까지  쭉 사용가능합니다 01071849292   챗확인 늦습니다  전화주심 빠른거래및 네고 가능합니다 전체적으로 상태는 양호합니다",14,0,8,389,37.5°C,https://www.daangn.com/kr/buy-sell/%EC%95%BC%EB%A7%88%ED%95%98cs-%EA%B3%A8%ED%94%84%EC%B1%84-%ED%92%80%EC%84%B8%ED%8A%B8-gzpk5j436wdf/
베고니아 고스트라이더,"12,000원",대전 서구 둔산동,끌올 2시간 전,판매중,캐모마일,잎이 멋진 베고니아 입니다. 반그늘에서 예쁘게 자랍니다. 조금 큰 다육화분에서 자라고 있는데 이대로 드릴게요. 비대면거래 합니다.,8,0,5,239,78.6°C,https://www.daangn.com/kr/buy-sell/%EB%B2%A0%EA%B3%A0%EB%8B%88%EC%95%84-%EA%B3%A0%EC%8A%A4%ED%8A%B8%EB%9D%BC%EC%9D%B4%EB%8D%94-6zaptazfs58a/
명절선물세트,"15,000원",대전 서구 둔산동,끌올 2시간 전,판매중,캐모마일,명절 선물 세트 새 상품입니다.  쇼핑백째 드립니다. 비대면거래 합니다.,6,1,9,614,78.6°C,https://www.daangn.com/kr/buy-sell/%EB%AA%85%EC%A0%88%EC%84%A0%EB%AC%BC%EC%84%B8%ED%8A%B8-1fjrkxnir49r/
핑g430 아이언세트 11자루+g430 3번유틸,"485,000원",충북 청주시 흥덕구 가경동,끌올 2시간 전,판매중,당근YG,아이언 11자루 4~p  45  50 54  58    3번유틸    모두 s플렉스 입니다  쿠팡 해외 직구  ㅡ   90만원  구입 정품 문의  사절     동일  국내 삼양 정품  사용중인데   스크린 세컨용으로  싼맛에  구입해서 잘 사용했습니다  삼양 정품 과  비교시타 가능합니다   차이는  잘 모르겠습니다    01071849292  전화주시고  쿨거래시  쿨네고 해드립니다     스크린 사용으로 상태는 매우 좋습니다,14,1,12,408,37.5°C,https://www.daangn.com/kr/buy-sell/%ED%95%91g430-%EC%95%84%EC%9D%B4%EC%96%B8%EC%84%B8%ED%8A%B8-11%EC%9E%90%EB%A3%A8-g430-3%EB%B2%88%EC%9C%A0%ED%8B%B8-3z8btnkw4jtz/
미니바이올렛 아가일삭스,"7,000원",대전 서구 둔산동,2시간 전,판매중,딩가,무늬종 미니바이올렛 아가일삭스입니다. 현재 꽃대가 5개 정도 올라오고 있어요. 화분 : 지름 8cm,10,0,1,26,90.9°C,https://www.daangn.com/kr/buy-sell/%EB%AF%B8%EB%8B%88%EB%B0%94%EC%9D%B4%EC%98%AC%EB%A0%9B-%EC%95%84%EA%B0%80%EC%9D%BC%EC%82%AD%EC%8A%A4-otrjvb425u4v/
어항 케이스 RTX2060 장착 본체,"595,000원",대전 서구 둔산동,끌올 2시간 전,판매중,스더,컴퓨터 잘 아시는 분이면 더 만족하실 사양입니다. RTX2060 들어간 가성비 본체예요. 사양 i5-9400F / RAM 16GB SSD 256GB / RTX 2060 파워 600W  본체 59만5천원  가성비 좋게 가져가세요!  문의주세요,5,2,9,395,36.9°C,https://www.daangn.com/kr/buy-sell/%EC%96%B4%ED%95%AD-%EC%BC%80%EC%9D%B4%EC%8A%A4-rtx2060-%EC%9E%A5%EC%B0%A9-%EB%B3%B8%EC%B2%B4-sxu7vnp5gnc9/
가성비 사무용 PC / 윈도우11 + 오피스 풀세팅,"320,000원",대전 서구 둔산동,끌올 2시간 전,판매중,스더,"여러 대 구매 후 사용하지 않고 보관만 해둔 PC입니다. 사무용, 재택근무, 학업용으로 충분한 사양이고 어항 케이스라 책상 위에 두면 보기에도 좋습니다. 윈도우11 정품 및 오피스(엑셀/워드/PPT/한글) 설치 완료. 코드만 꽂고 바로 사용하세요. 사양 i5 6세대 SSD 256GB 삼성 8GB RAM 인텔 내장그래픽 500W 파워 32만원에 판매합니다.",5,3,11,781,36.9°C,https://www.daangn.com/kr/buy-sell/%EA%B0%80%EC%84%B1%EB%B9%84-%EC%82%AC%EB%AC%B4%EC%9A%A9-pc-%EC%9C%88%EB%8F%84%EC%9A%B011-%EC%98%A4%ED%94%BC%EC%8A%A4-%ED%92%80%EC%84%B8%ED%8C%85-p34trz73n9k4/
롤 배그 로아 잘 돌아가는 고사양 PC,"800,000원",대전 서구 둔산동,끌올 2시간 전,판매중,스더,"롤 풀옵 / 발로 풀옵 / 배그 상옵 / 로아 상옵 등 원활하게 돌아가는 사양입니다.  고사양이라 작업용으로도 쾌적하게 가능해요  윈도우랑 오피스 다 정품인증되어 있으니 코드 꼽으시고 바로 사용하시면 됩니다  -CPU i5 10400F -SSD 256기가 -그래픽카드 RTX3070 -램 16기가 -파워 700W 편하게 문의주세요 ^^",5,0,5,345,36.9°C,https://www.daangn.com/kr/buy-sell/%EB%A1%A4-%EB%B0%B0%EA%B7%B8-%EB%A1%9C%EC%95%84-%EC%9E%98-%EB%8F%8C%EC%95%84%EA%B0%80%EB%8A%94-%EA%B3%A0%EC%82%AC%EC%96%91-pc-147axcbr7zum/
벤츠 GLE 쿠페 라디에이터 순정 그릴,"90,000원",대전 서구 둔산동,끌올 2시간 전,판매중,페어웨이,벤츠 GLE 쿠페 라디에이터 그릴 벤츠 그릴 순정품 품번 A292 888 00 60 상태 양호합니다.,11,0,0,36,71.6°C,https://www.daangn.com/kr/buy-sell/%EB%B2%A4%EC%B8%A0-gle-%EC%BF%A0%ED%8E%98-%EB%9D%BC%EB%94%94%EC%97%90%EC%9D%B4%ED%84%B0-%EC%88%9C%EC%A0%95-%EA%B7%B8%EB%A6%B4-vhsqyiq41oow/
스팸 선물세트 8k호,"22,000원",대전 서구 둔산동,2시간 전,판매중,박여름,"스팸 선물세트 8k호입니다 라이트3개, 클래식6개 28년 2월 1일까지 소비기한입니다",6,0,0,73,59.1°C,https://www.daangn.com/kr/buy-sell/%EC%8A%A4%ED%8C%B8-%EC%84%A0%EB%AC%BC%EC%84%B8%ED%8A%B8-8k%ED%98%B8-e97ztve1wm61/
에이블리 레더 크롭 패딩 블랙,"10,000원",대전 서구 둔산동,2시간 전,판매중,hri,에이블리 블랙 레더 크롭 숏패딩 상태 좋아요 후기좋고 이뻐요 !!,5,0,0,3,82.6°C,https://www.daangn.com/kr/buy-sell/%EC%97%90%EC%9D%B4%EB%B8%94%EB%A6%AC-%EB%A0%88%EB%8D%94-%ED%81%AC%EB%A1%AD-%ED%8C%A8%EB%94%A9-%EB%B8%94%EB%9E%99-so6tvxxpz55j/
크림스킨 리필 + 미니 + 미스트펌프,"15,000원",대전 서구 둔산동,끌올 2시간 전,판매중,0plmlp0,170 ml 리필 28년 7월 50 ml 미니 28년 9월 미스트펌프 둔산동 직거래,5,0,8,54,37.7°C,https://www.daangn.com/kr/buy-sell/%ED%81%AC%EB%A6%BC%EC%8A%A4%ED%82%A8-%EB%A6%AC%ED%95%84-%EB%AF%B8%EB%8B%88-%EB%AF%B8%EC%8A%A4%ED%8A%B8%ED%8E%8C%ED%94%84-yoowtsn37fx5/
에어보스 바구니형 카시트,"10,000원",대전 서구 둔산동,2시간 전,판매중,haley,에어보스 바구니형 카시트 판매합니다 신생아부터 사용 가능한 제품입니다 23년에 구매해서 사용했습니다. 신생아가 쓰던거라 과자흘린것 없이 깨끗합니다. 어깨끈에 보호커버 하나 없습니다.,5,2,5,65,39.1°C,https://www.daangn.com/kr/buy-sell/%EC%97%90%EC%96%B4%EB%B3%B4%EC%8A%A4-%EB%B0%94%EA%B5%AC%EB%8B%88%ED%98%95-%EC%B9%B4%EC%8B%9C%ED%8A%B8-jft29nx55i5w/
네츄럴더마 엔디피 비타민 B9 톤업미백크림,"23,000원",대전 서구 둔산동,끌올 2시간 전,판매중,0plmlp0,"65 ml 한번사용 28년 3월 NDP홈페이지, 올리브영홈페이지,네이버쇼핑,블로그에서 가격비교,제품설명,사용후기들 참고하세요~ 둔산동 직거래",5,0,2,19,37.7°C,https://www.daangn.com/kr/buy-sell/%EB%84%A4%EC%B8%84%EB%9F%B4%EB%8D%94%EB%A7%88-%EC%97%94%EB%94%94%ED%94%BC-%EB%B9%84%ED%83%80%EB%AF%BC-b9-%ED%86%A4%EC%97%85%EB%AF%B8%EB%B0%B1%ED%81%AC%EB%A6%BC-fg6vibnc9ggf/
아비브 부활초 파하토너 스킨부스터,"14,000원",대전 서구 둔산동,끌올 2시간 전,판매중,0plmlp0,"1센치사용 200 ml 27년 6월 올리브영홈페이지,네이버쇼핑,블로그에서 제품설명, 가격비교,사용후기들 참고하세요~ 둔산동 직거래",5,0,2,32,37.7°C,https://www.daangn.com/kr/buy-sell/%EC%95%84%EB%B9%84%EB%B8%8C-%EB%B6%80%ED%99%9C%EC%B4%88-%ED%8C%8C%ED%95%98%ED%86%A0%EB%84%88-%EC%8A%A4%ED%82%A8%EB%B6%80%EC%8A%A4%ED%84%B0-sucfoe9wms6x/
엘라스틴 실크리페어 샤이닝 윤기영양 샴푸,"5,000원",대전 서구 둔산동,끌올 2시간 전,판매중,0plmlp0,1회사용 용량 550ml 실크리페어 샤이닝 윤기 영양 체리블라썸향 27년 6월 둔산동 직거래,6,3,6,147,37.7°C,https://www.daangn.com/kr/buy-sell/%EC%97%98%EB%9D%BC%EC%8A%A4%ED%8B%B4-%EC%8B%A4%ED%81%AC%EB%A6%AC%ED%8E%98%EC%96%B4-%EC%83%A4%EC%9D%B4%EB%8B%9D-%EC%9C%A4%EA%B8%B0%EC%98%81%EC%96%91-%EC%83%B4%ED%91%B8-9mjahytibnas/
