title,price,location,time,status,seller_nickname,description,image_count,chat_count,interest_count,view_count,manner_temperature,url
로케트 Plus Edition RP200-12 배터리,"70,000원",대전 서구 둔산동,끌올 1시간 전,판매중,얼죽아,"로케트 Plus Edition RP200-12 산업용 배터리 판매합니다. 12V 200AH 제품이에요. 제조일자는 22년 7월 14일입니다 전기실 안 전기함에서 상시충전중이던 배터리입니다. 가로 525mm 세로 281mm 높리 223mm입니다. 무게는 55kg이에요 모두 12.7V이상 측정됩니다! 대용량이라 캠핑, 낚시, 아웃도어 하시는분들도 추천드려요. 1개당 가격이에요. 거래는 오정동에서 가능합니다",7,16,32,1203,37.0°C,https://www.daangn.com/kr/buy-sell/%EB%A1%9C%EC%BC%80%ED%8A%B8-plus-edition-rp200-12-%EB%B0%B0%ED%84%B0%EB%A6%AC-o5be5zrpxu34/
삼성 외장하드 Y3 2TB HX-MK20Y3C,"120,000원",대전 서구 둔산동,끌올 1시간 전,판매중,땅꼬마,삼성 외장하드 Y3 2TB 모델입니다 모델명은 HX-MK20Y3C입니다 - 슬림하고 가벼운 디자인으로 휴대하기 편리합니다 - 데이터 보호 기능으로 안심하고 사용할 수 있습니다 케이스와 케이블 함께 드립니다 쿠팡에서 15만9천원에 구매했고 일주일지났습니다 사용도안한 세제품이에요! 필요해서 샀는데 필요가없어져서 판매해여 ㅠㅠ,9,3,8,89,36.5°C,https://www.daangn.com/kr/buy-sell/%EC%82%BC%EC%84%B1-%EC%99%B8%EC%9E%A5%ED%95%98%EB%93%9C-y3-2tb-hx-mk20y3c-u6r76mfbt3ks/
산업안전지도사 필기 교재,"60,000원",대전 서구 둔산동,1시간 전,판매중,썬더,산업안전지도사 1차 필기 교재입니다 2026년까지 사용 가능합니다 새상품입니다. 올해 시험보려고 했으나 미응시로 필요하신분게 판매합니다. 쿨거래시 에눌가능,5,0,0,3,63.4°C,https://www.daangn.com/kr/buy-sell/%EC%82%B0%EC%97%85%EC%95%88%EC%A0%84%EC%A7%80%EB%8F%84%EC%82%AC-%ED%95%84%EA%B8%B0-%EA%B5%90%EC%9E%AC-4v42arnu2idj/
새제품 이케아 MACKAPAR 코트걸이 신발수납 세트,"45,000원",대전 서구 둔산동,1시간 전,판매중,당근소보로,시청역 직거래합니다! 박스채 미개봉 미사용,6,0,2,15,38.6°C,https://www.daangn.com/kr/buy-sell/%EC%83%88%EC%A0%9C%ED%92%88-%EC%9D%B4%EC%BC%80%EC%95%84-mackapar-%EC%BD%94%ED%8A%B8%EA%B1%B8%EC%9D%B4-%EC%8B%A0%EB%B0%9C%EC%88%98%EB%82%A9-%EC%84%B8%ED%8A%B8-g8hkrzwev3uz/
"갤럭시 a23 128gb 블랙, 화이트","100,000원",대전 서구 둔산동,1시간 전,판매중,잔소리쟁이,사무실에서 사용하던 폰 정리합니다!! 정상해지된 폰입니다!! 연락주세요! 개당 10만,6,0,2,21,41.3°C,https://www.daangn.com/kr/buy-sell/%EA%B0%A4%EB%9F%AD%EC%8B%9C-a23-128gb-%EB%B8%94%EB%9E%99-%ED%99%94%EC%9D%B4%ED%8A%B8-uirku8g8k4mg/
센트룸 맨 더블업 60정(2개월분) 3개 새상품,"15,000원",대전 서구 둔산동,끌올 1시간 전,판매중,로렌맘,센트룸 맨 더블업 60정 3개 개봉안한 새제품입니다 1개당 15000원에 판매할게요 남성을 위한 23가지 비타민과 미네랄을 함유하고 있습니다 소비기한은 2026년 11월 5일까지입니다 비대면문고리거래요!,6,4,32,283,39.6°C,https://www.daangn.com/kr/buy-sell/%EC%84%BC%ED%8A%B8%EB%A3%B8-%EB%A7%A8-%EB%8D%94%EB%B8%94%EC%97%85-60%EC%A0%95-2%EA%B0%9C%EC%9B%94%EB%B6%84-3%EA%B0%9C-%EC%83%88%EC%83%81%ED%92%88-68dsz2jmme4t/
주식 투자 도서 3권,"6,000원",대전 서구 둔산동,끌올 1시간 전,판매중,달팽이전문가10년차,주식 투자 관련 도서 3권 - 제시 리버모어 - 승률 게임 - 데이트레이딩 상태는 사진 참고해주세요~ 상태는좋습니다 내부도 새책처럼깔끔합니다 가격은 개별가격입니당 교환환불xxxxxx,6,3,8,461,37.4°C,https://www.daangn.com/kr/buy-sell/%EC%A3%BC%EC%8B%9D-%ED%88%AC%EC%9E%90-%EB%8F%84%EC%84%9C-3%EA%B6%8C-xx5qwouieg6h/
베고니아 신밧드,"5,000원",대전 서구 둔산동,1시간 전,판매중,딩가,목베고니아 신밧드입니다. 화분 : 지름 8cm,9,0,0,3,90.9°C,https://www.daangn.com/kr/buy-sell/%EB%B2%A0%EA%B3%A0%EB%8B%88%EC%95%84-%EC%8B%A0%EB%B0%A7%EB%93%9C-u2prffs5tvxf/
Mackage Moritz-X 블랙 패딩 40사이즈,"620,000원",대전 서구 둔산동,끌올 1시간 전,판매중,당근도둑,맥케이지 모르츠 X 블랙 실버퍼 패딩입니다 사이즈는 40사이즈입니다 실착은 l-xl정도 됩니다! 네고 가능합니다  궁금하신건 사진 더 찍어서 보내줄수 있어요 편하게 연락주세요!,11,2,1,52,37.3°C,https://www.daangn.com/kr/buy-sell/mackage-moritz-x-%EB%B8%94%EB%9E%99-%ED%8C%A8%EB%94%A9-40%EC%82%AC%EC%9D%B4%EC%A6%88-szopsdkaeof5/
4월 전일정 박효신 A&E 2026 인천 콘서트,"250,000원",대전 서구 둔산동,1시간 전,판매중,누구세용,"박효신 LIVE A & E 2026 인천 콘서트  인천문학경기장 주경기장 4월 4일(토) 연석 FLOOR &3구역 2열  FLOOR &10구역 2열 4월 5일(일) 연석 FLOOR &14구역 1,2열 4월 11일(토) 연석 FLOOR &1구역 1열 FLOOR &4구역 2열  낱개로도 구매가 가능합니다",5,2,2,31,36.5°C,https://www.daangn.com/kr/buy-sell/4%EC%9B%94-%EC%A0%84%EC%9D%BC%EC%A0%95-%EB%B0%95%ED%9A%A8%EC%8B%A0-a-e-2026-%EC%9D%B8%EC%B2%9C-%EC%BD%98%EC%84%9C%ED%8A%B8-f8nxdugsbf1w/
호식이두마리치킨 7천원 요기요 할인쿠폰,300원,대전 동구 대동,1시간 전,판매중,당근온도,"요기요 앱에서 호식이두마리치킨 주문 시 사용 가능한 7,000원 할인 쿠폰입니다 2월 11일(수)부터 2월 13일(금)까지 사용 가능합니다",5,0,0,4,75.5°C,https://www.daangn.com/kr/buy-sell/%ED%98%B8%EC%8B%9D%EC%9D%B4%EB%91%90%EB%A7%88%EB%A6%AC%EC%B9%98%ED%82%A8-7%EC%B2%9C%EC%9B%90-%EC%9A%94%EA%B8%B0%EC%9A%94-%ED%95%A0%EC%9D%B8%EC%BF%A0%ED%8F%B0-xe2724zwu59s/
슈퍼윙스 월드비행본부,"10,000원",대전 서구 둔산동,1시간 전,판매중,byeol,"슈퍼윙스 월드비행본부 입니다 파손, 변색 없이 깨끗합니다 빛, 소리도 잘 나와요 가격제안 받아요~ 환불 X",6,0,1,11,46.6°C,https://www.daangn.com/kr/buy-sell/%EC%8A%88%ED%8D%BC%EC%9C%99%EC%8A%A4-%EC%9B%94%EB%93%9C%EB%B9%84%ED%96%89%EB%B3%B8%EB%B6%80-c56joi89d72c/
미니빈티지 유리문 나무 수납장,"30,000원",대전 서구 둔산동,1시간 전,판매중,가을바람,빈티지 스타일의 나무 수납장입니다 - 유리문으로 되어있어 내부를 확인할 수 있습니다 - 하단에 서랍 2개가 있어 수납 공간이 넉넉합니다 - 나무 재질로 만들어져 튼튼하고 오래 사용할 수 있습니다 - 갈색톤으로 은은한 분위기를 연출합니다 31-36센치,7,1,3,89,99.0°C,https://www.daangn.com/kr/buy-sell/%EB%AF%B8%EB%8B%88%EB%B9%88%ED%8B%B0%EC%A7%80-%EC%9C%A0%EB%A6%AC%EB%AC%B8-%EB%82%98%EB%AC%B4-%EC%88%98%EB%82%A9%EC%9E%A5-zu4f5bo5c33z/
자라 바스켓백(새상품),"38,000원",대전 서구 둔산동,끌올 1시간 전,판매중,스누피,트랜비에서 7만원대 구입했는데 색감이랑 디자인은 맘에드는데 생각보다 사이즈가 커서 한번도 안쓰고 보관만한 상태예요 현재는 품절된상태고 직접 가지러 오셔야하고  예민하신분 찔러보기 택배거래 사양합니다 가로 58 세로38 폭 19,8,1,2,85,49.8°C,https://www.daangn.com/kr/buy-sell/%EC%9E%90%EB%9D%BC-%EB%B0%94%EC%8A%A4%EC%BC%93%EB%B0%B1-%EC%83%88%EC%83%81%ED%92%88-5216ie9mqsii/
대형 화이트보드 판매(2500*1250),"100,000원",대전 서구 둔산동,1시간 전,판매중,겨울체리,"학원 정리로 인해 대형 화이트보드 판매합니다. 사이즈는 2500*1250 이며, 구매 후 1년도 채 사용하지 않아 상태 좋습니다. 비싸게 주고 설치한 제품이라 퀄리티 좋습니다. 위치는 대전 탄방동이고, 부피가 큰 제품이라 직접 가져가셔야 합니다. 관심 있으신 분은 연락 주세요 🙂",5,0,0,10,36.7°C,https://www.daangn.com/kr/buy-sell/%EB%8C%80%ED%98%95-%ED%99%94%EC%9D%B4%ED%8A%B8%EB%B3%B4%EB%93%9C-%ED%8C%90%EB%A7%A4-2500-1250-12wwg3fdn63d/
아디다스 오리지널 맨투맨 (가격조정없음),"15,000원",대전 서구 둔산동,끌올 1시간 전,판매중,스누피,"아디다스 Originals 투톤 맨투맨 L사이즈입니다  블루와 베이지컬러 두가지색상은 수직으로  절개하여 합친 스타일이고 현재는 단종된 시즌 한정판이었어요  아이들이 무채색옷을 조아해서. 거의몇번입지않고 보관만했고 서랍에 접어 넣어서 생긴 주름입니다 전체적으로 깨끗하지만 생활감,생활기스 있을수 있으니 예민하신분, 찔러보기, 보고 판단하고 입어보시겠다는분들, 반품 절대 사양합니다  최소한 채팅매너도 지켜주시고 당근페이로 선입금시 문고리거래만 하겠습니다 (대략 품은58/ 기장 71정도)",11,1,4,226,49.8°C,https://www.daangn.com/kr/buy-sell/%EC%95%84%EB%94%94%EB%8B%A4%EC%8A%A4-%EC%98%A4%EB%A6%AC%EC%A7%80%EB%84%90-%EB%A7%A8%ED%88%AC%EB%A7%A8-%EA%B0%80%EA%B2%A9%EC%A1%B0%EC%A0%95%EC%97%86%EC%9D%8C-9xfrpiu9qgy5/
카봇 에이스 레스큐 올스타,"10,000원",대전 서구 둔산동,1시간 전,판매중,byeol,"카봇 에이스 레스큐 올스타 입니다 파손, 변색 없이 깨끗합니다 빛, 소리도 잘 나와요 가격제안 받아요~ 환불 X",6,0,1,11,46.6°C,https://www.daangn.com/kr/buy-sell/%EC%B9%B4%EB%B4%87-%EC%97%90%EC%9D%B4%EC%8A%A4-%EB%A0%88%EC%8A%A4%ED%81%90-%EC%98%AC%EC%8A%A4%ED%83%80-tp1tpw385qdb/
앤틱 탁상 시계,"120,000원",대전 서구 둔산동,1시간 전,판매중,가을바람,"앤틱 스타일의 탁상 시계입니다 나무 재질로 되어있고, 갈색톤입니다 섬세한 장식 디테일이 돋보입니다 높이40센치 가로29센치",8,0,1,20,99.0°C,https://www.daangn.com/kr/buy-sell/%EC%95%A4%ED%8B%B1-%ED%83%81%EC%83%81-%EC%8B%9C%EA%B3%84-fz2pjoiy69sd/
대형 칠판 판매(2500*1250),"200,000원",대전 서구 둔산동,1시간 전,판매중,겨울체리,"학원 정리로 인해 대형 칠판 판매합니다. 사이즈는 2500*1250 이며, 구매 후 1년도 채 사용하지 않아 상태 좋습니다. 비싸게 주고 설치한 제품이라 퀄리티 좋습니다. 위치는 대전 탄방동이고, 부피가 큰 제품이라 직접 가져가셔야 합니다. 관심 있으신 분은 연락 주세요 🙂",5,0,0,3,36.7°C,https://www.daangn.com/kr/buy-sell/%EB%8C%80%ED%98%95-%EC%B9%A0%ED%8C%90-%ED%8C%90%EB%A7%A4-2500-1250-5kyayk9kb3y2/
버버리 빈티지 실크 스카프 새상품급,"100,000원",대전 서구 둔산동,끌올 1시간 전,판매중,우왘,"버버리(Burberrys) 빈티지 실크 스카프 - 사이즈는 약 90cm x 90cm입니다 - 부드러운 실크 소재입니다 - 베이지색 바탕에 버버리 특유의 체크 패턴이 고급스러워요 - 특별한 날 포인트로 연출하기 좋습니다 이 제품은 버버리가 1999년 이전에 사용하던 로고인 'Burberrys'(끝에 's'가 붙은 형태)가 새겨진 빈티지 모델로, 승마 채찍(Whip)과 말 머리 장식 등이 어우러진 클래식한 테마의 디자인입니다. ​제품 상세 정보 ​브랜드: Burberrys (빈티지 버버리) ​패턴명: 에퀘스트리안/윕(Equestrian/Whip) 테마 ​소재: 100% 실크 (Silk) ​특징: 버버리 특유의 노바 체크(Nova Check) 테두리와 중앙의 화려한 골드 톤 그래픽이 특징인 스퀘어 스카프입니다. 거의 새제품 상태 최상입니다.",8,0,6,163,48.4°C,https://www.daangn.com/kr/buy-sell/%EB%B2%84%EB%B2%84%EB%A6%AC-%EB%B9%88%ED%8B%B0%EC%A7%80-%EC%8B%A4%ED%81%AC-%EC%8A%A4%EC%B9%B4%ED%94%84-%EC%83%88%EC%83%81%ED%92%88%EA%B8%89-1c4ux8zpvnnm/
알레시(Alessi) '비엔나(Vienna)' 쓰레기통 휴지통,"300,000원",대전 서구 둔산동,끌올 1시간 전,판매중,우왘,"알레시(Alessi)**의 '비엔나(Vienna)' 쓰레기통입니다. 실제로는 비닐 및 쇼핑백 보관용으로 썼습니다. 아실 만한 분들만 구매하실 테니 설명은 필요도 없겠지만, 설명은 아래와 같습니다. 아래는 제미나이 검색내용입니다. ​유명 디자이너 **알레산드로 멘디니(Alessandro Mendini)**가 디자인한 제품으로, 고전적인 휴지통 실루엣에 화려한 금색 핸들과 노브(손잡이)를 더해 포스트모던한 감성을 담아낸 것이 특징입니다. ​제품 상세 정보 ​브랜드: 알레시 (Alessi) ​디자이너: 알레산드로 멘디니 (Alessandro Mendini) ​특징: 본체 전면에 특유의 별 모양(*) 양각 로고가 있으며, 화려한 바로크 스타일의 금색 손잡이가 달려 있습니다. 페달식으로 작동하며 내부에 별도의 버킷이 포함된 구조입니다.​ 이 제품은 현재 단종되었거나 구하기 힘든 빈티지 디자인 소품으로 분류되어 컬렉터들 사이에서 인기가 높습니다. 해외 빈티지 사이트에서는 상태에 따라 $400 ~ $600 선에 거래되기도 합니다.",14,0,2,133,48.4°C,https://www.daangn.com/kr/buy-sell/%EC%95%8C%EB%A0%88%EC%8B%9C-alessi-%EB%B9%84%EC%97%94%EB%82%98-vienna-%EC%93%B0%EB%A0%88%EA%B8%B0%ED%86%B5-%ED%9C%B4%EC%A7%80%ED%86%B5-ikmpjqe9a5h3/
르쿠르제 루크루제 무쇠 냄비 22cm 옐로우 찜기포함,"150,000원",대전 서구 둔산동,끌올 1시간 전,판매중,우왘,르쿠르제 르크루제 무쇠 냄비 22cm 옐로우 색상입니다 찜기 함께 드립니다 무쇠 재질로 열 보존율이 뛰어나 요리가 맛있게 됩니다 색감 정말 예뻐요. 제품만 있습니다.,11,0,8,246,48.4°C,https://www.daangn.com/kr/buy-sell/%EB%A5%B4%EC%BF%A0%EB%A5%B4%EC%A0%9C-%EB%A3%A8%ED%81%AC%EB%A3%A8%EC%A0%9C-%EB%AC%B4%EC%87%A0-%EB%83%84%EB%B9%84-22cm-%EC%98%90%EB%A1%9C%EC%9A%B0-%EC%B0%9C%EA%B8%B0%ED%8F%AC%ED%95%A8-ewdair5keznc/
티파니앤코 리턴 투 하트 팔찌팝니다,"150,000원",대전 서구 둔산동,1시간 전,판매중,징니,"티파니앤코 리턴 투 티파니 팔찌입니다 면세에서 구매한 정품인데 상자 케이스는 없고 더스트백만 있어요 사이즈는xs이였던걸로 기억하는데 제 손목둘레는 14cm정도 되네요, 팬던트에 생활기스는 있는점 유의해주세요",8,0,3,50,38.5°C,https://www.daangn.com/kr/buy-sell/%ED%8B%B0%ED%8C%8C%EB%8B%88%EC%95%A4%EC%BD%94-%EB%A6%AC%ED%84%B4-%ED%88%AC-%ED%95%98%ED%8A%B8-%ED%8C%94%EC%B0%8C%ED%8C%9D%EB%8B%88%EB%8B%A4-d6h7izydtngw/
중소기업 인사노무관리.단편소설 책.도서,500원,경기 수원시 영통구 매탄동,끌올 1시간 전,판매중,서영화광,권당 입니다 거래는 용머리어린이공원.오룡역 근처에서 합니다.  구매자가 원하는 위치도 가능합니다. 택배 및 반값택배 가능합니다 직장 때문에 답변이 늦을 수 있어요. 문자 남겨주시면 늦어도 저녁 쯤 답장 보내드릴게요,5,0,0,8,53.7°C,https://www.daangn.com/kr/buy-sell/%EC%A4%91%EC%86%8C%EA%B8%B0%EC%97%85-%EC%9D%B8%EC%82%AC%EB%85%B8%EB%AC%B4%EA%B4%80%EB%A6%AC-%EB%8B%A8%ED%8E%B8%EC%86%8C%EC%84%A4-%EC%B1%85-%EB%8F%84%EC%84%9C-erxvicx355ou/
샌디스크 익스트림 프로 듀얼 드라이브 2TB 미개봉,"225,000원",대전 서구 둔산동,끌올 1시간 전,판매중,pacosanta,샌디스크 익스트림 프로 듀얼 드라이브 2TB  - 미개봉 신품,5,0,5,93,47.6°C,https://www.daangn.com/kr/buy-sell/%EC%83%8C%EB%94%94%EC%8A%A4%ED%81%AC-%EC%9D%B5%EC%8A%A4%ED%8A%B8%EB%A6%BC-%ED%94%84%EB%A1%9C-%EB%93%80%EC%96%BC-%EB%93%9C%EB%9D%BC%EC%9D%B4%EB%B8%8C-2tb-%EB%AF%B8%EA%B0%9C%EB%B4%89-ynczcq47g22o/
대형 칠판 판매(3400*1250),"300,000원",대전 서구 둔산동,1시간 전,판매중,겨울체리,"학원 정리로 인해 대형 칠판 판매합니다. 사이즈는 3400*1250 이며, 구매 후 1년도 채 사용하지 않아 상태 좋습니다. 100만원 넘게 주고 설치한 제품입니다. 위치는 대전 탄방동이고, 부피가 큰 제품이라 직접 가져가셔야 합니다. 관심 있으신 분은 연락 주세요 🙂",5,1,0,12,36.7°C,https://www.daangn.com/kr/buy-sell/%EB%8C%80%ED%98%95-%EC%B9%A0%ED%8C%90-%ED%8C%90%EB%A7%A4-3400-1250-8c4qwhf7k1om/
"진도 엘페 다이애나 블랙 55 새상품급,가격내림73만","730,000원",대전 서구 둔산동,끌올 1시간 전,판매중,이진이봄이,"고급스러운 SAGA RANCH 블랙 밍크 자켓입니다 전체적으로 상태 양호하며, 밍크 특유의 윤기가 살아있어 고급스러움을 더해줍니다 가슴둘레 91cm, 엉덩이둘레 98cm, 신장 160cm에 적합한 55사이즈입니다 따뜻하고 세련된 디자인으로 다양한 스타일에 매치하기 좋습니다 유행안타는 디자인으로 젊어보이는 밍크입니다 최상급 다이애나 블랙으로 입으면 더 고급스러워요  오백만원 넘게 신세계 강남에서 구매후 다른 밍크를 입느라고 몇번 안입어서 상태 좋습니다 득템하세요  73만 노리턴 노환불 매너거래 원해요  택배가능 착불",9,2,12,423,59.5°C,https://www.daangn.com/kr/buy-sell/%EC%A7%84%EB%8F%84-%EC%97%98%ED%8E%98-%EB%8B%A4%EC%9D%B4%EC%95%A0%EB%82%98-%EB%B8%94%EB%9E%99-55-%EC%83%88%EC%83%81%ED%92%88%EA%B8%89-%EA%B0%80%EA%B2%A9%EB%82%B4%EB%A6%BC73%EB%A7%8C-99cyv8f7mivj/
베고니아 스카피게라,"8,000원",대전 서구 둔산동,1시간 전,판매중,딩가,"약간의 광택이 있는 동글동글 연두잎, 테두리는 붉은 라인이 특징이에요. 화분 : 지름 6.5cm  팔각",10,0,0,9,90.9°C,https://www.daangn.com/kr/buy-sell/%EB%B2%A0%EA%B3%A0%EB%8B%88%EC%95%84-%EC%8A%A4%EC%B9%B4%ED%94%BC%EA%B2%8C%EB%9D%BC-noju5qrdor4o/
(새상품)독학으로 끝내는 금융공기업 논술,"4,000원",대전 서구 둔산동,끌올 1시간 전,판매중,또또106,금융공기업 논술 대비책입니다. 완전 새책이에요 27000-> 5000,5,0,1,16,39.0°C,https://www.daangn.com/kr/buy-sell/%EC%83%88%EC%83%81%ED%92%88-%EB%8F%85%ED%95%99%EC%9C%BC%EB%A1%9C-%EB%81%9D%EB%82%B4%EB%8A%94-%EA%B8%88%EC%9C%B5%EA%B3%B5%EA%B8%B0%EC%97%85-%EB%85%BC%EC%88%A0-f9c14qqi1496/
공기업 NCS 독학으로 끝내는 PSAT 문제해결+자원관리능력,"4,000원",대전 서구 둔산동,끌올 1시간 전,판매중,또또106,문제랑 해설 세트입니다. 앞에 약간 메모가 되어있는데 풀지는 않았어요! 일괄 5000원,6,0,8,62,39.0°C,https://www.daangn.com/kr/buy-sell/%EA%B3%B5%EA%B8%B0%EC%97%85-ncs-%EB%8F%85%ED%95%99%EC%9C%BC%EB%A1%9C-%EB%81%9D%EB%82%B4%EB%8A%94-psat-%EB%AC%B8%EC%A0%9C%ED%95%B4%EA%B2%B0-%EC%9E%90%EC%9B%90%EA%B4%80%EB%A6%AC%EB%8A%A5%EB%A0%A5-s82srk12p9uu/
공룡 피규어 15종 세트,"2,000원",대전 서구 둔산동,끌올 1시간 전,판매중,사색하는토끼,"다양한 종류와 색상의 공룡 피규어 세트입니다 총 15개이고 아이들이 가지고 놀기 좋은 사이즈입니다 깨끗하게 갖고 놀았지만 중고상품인 점 감안하셔야 하고, 구매 후 환불이나 반품은 불가하니 신중하게 구매 부탁드립니다",7,0,0,51,37.6°C,https://www.daangn.com/kr/buy-sell/%EA%B3%B5%EB%A3%A1-%ED%94%BC%EA%B7%9C%EC%96%B4-15%EC%A2%85-%EC%84%B8%ED%8A%B8-x3j9k4drrqem/
(새상품)스투시 소다캔 기모후드티M,"65,000원",대전 서구 둔산동,끌올 1시간 전,판매중,모찌언니,"스투시 소다캔 기모 후드티 멜란지 그레이 색상 새상품입니다 사진에서 보시는 것처럼 택도 그대로 달려있는 미개봉 새제품이에요 기모 안감으로 따뜻하고 편안하게 착용하기 좋으며, 스투시 특유의 스트릿 감성이 돋보이는 디자인입니다 어떤 코디에도 잘 어울리는 활용도 높은 아이예요. ☑️가단56총장68 병행수입정품 환불,교환❌ 인사.찌르기사절 네고,비매너❌ 불펌금지😩 노쇼차단합니다ㅜ 선입금우선거래 택배(당일택배) 저렴히 올린 금액이니  말도 안되는 에눌은 대화는 정중히 사양하겠습니다🙏 택배요청시 3천원 추가비용~",7,0,2,25,63.6°C,https://www.daangn.com/kr/buy-sell/%EC%83%88%EC%83%81%ED%92%88-%EC%8A%A4%ED%88%AC%EC%8B%9C-%EC%86%8C%EB%8B%A4%EC%BA%94-%EA%B8%B0%EB%AA%A8%ED%9B%84%EB%93%9C%ED%8B%B0m-ucvwzjg1ys5a/
대형 칠판 (3760*1250),"300,000원",대전 서구 둔산동,1시간 전,판매중,겨울체리,"학원 정리로 인해 대형 칠판 판매합니다. 사이즈는 3760*1250 이며, 구매 후 1년도 채 사용하지 않아 상태 좋습니다. 100만원 넘게 주고 설치한 제품입니다. 위치는 대전 탄방동이고, 부피가 큰 제품이라 직접 가져가셔야 합니다. 관심 있으신 분은 연락 주세요 🙂",5,0,0,4,36.7°C,https://www.daangn.com/kr/buy-sell/%EB%8C%80%ED%98%95-%EC%B9%A0%ED%8C%90-3760-1250-313rxizegph4/
다이와 여성아이언세트외 풀세트,"280,000원",대전 서구 둔산동,끌올 1시간 전,판매중,01031469294,다이와정품  아이언 6789pas ㅡ   28만원 드라이버 우드 유틸 퍼터  캐디백 ㅡ  45만원 유틸만 해두 신품 30만원 넘게주고 구입했습니다 공일공사육사육 팔일공팔 ㅡ 전화주심 쿨네고 가능 일괄은  55만원 네고 불가  합니다   연습장보관중  시타도 가능합니다,11,1,4,390,43.5°C,https://www.daangn.com/kr/buy-sell/%EB%8B%A4%EC%9D%B4%EC%99%80-%EC%97%AC%EC%84%B1%EC%95%84%EC%9D%B4%EC%96%B8%EC%84%B8%ED%8A%B8%EC%99%B8-%ED%92%80%EC%84%B8%ED%8A%B8-6f2iavaasyhn/
또봇 Y 스마트키,"20,000원",대전 서구 둔산동,1시간 전,판매중,byeol,"또봇 Y 스마트키 입니다 파손, 변색 없이 깨끗합니다 소리도 잘 나와요 가격제안 받아요~ 환불 X",5,0,0,8,46.6°C,https://www.daangn.com/kr/buy-sell/%EB%98%90%EB%B4%87-y-%EC%8A%A4%EB%A7%88%ED%8A%B8%ED%82%A4-gdsnxguiwz47/
미즈노 MX-25 아이언 세트 외 골프세트,"185,000원",대전 서구 둔산동,끌올 1시간 전,판매중,01031469294,"드라이버ㆍ우드 ㆍ유틸 ㆍ미즈노 MX-25 아이언56789 세트와 렌스필드 웨지p  s, 콩코드 퍼터, 인터내셔널 크라운 골프백 함께 판매합니다 아이언은 MX-25 모델이며, 웨지pw  sw  는 렌스필드 제품입니다 퍼터는 Concorde 모델입니다 전체적으로 사용감은 있지만  사용상 문제 없습니다 그립 교환하지 않고 사용가능한  상태입니다  010 4646  8108  전화주심  쿨네고 해드립니다",8,1,10,777,43.5°C,https://www.daangn.com/kr/buy-sell/%EB%AF%B8%EC%A6%88%EB%85%B8-mx-25-%EC%95%84%EC%9D%B4%EC%96%B8-%EC%84%B8%ED%8A%B8-%EC%99%B8-%EA%B3%A8%ED%94%84%EC%84%B8%ED%8A%B8-u1nhpc4fr36u/
에르메스 여성 가죽 장갑 블랙 당근합니다,"65,000원",대전 서구 둔산동,1시간 전,판매중,새하얀빛으로,"도톰한 퍼 안감으로 보온성 좋아요 착용 안 하고 보관만 해서 상태 좋아요 스마트폰 터치 지원돼 외출 시 편해요",8,0,0,0,30.7°C,https://www.daangn.com/kr/buy-sell/%EC%97%90%EB%A5%B4%EB%A9%94%EC%8A%A4-%EC%97%AC%EC%84%B1-%EA%B0%80%EC%A3%BD-%EC%9E%A5%EA%B0%91-%EB%B8%94%EB%9E%99-%EB%8B%B9%EA%B7%BC%ED%95%A9%EB%8B%88%EB%8B%A4-pr9bw5erumf1/
"다이와온오프G-three 여성 골프채 풀세트 (드라이버, 우드, 유틸, 아이언, 퍼터)","899,000원",대전 대덕구 오정동,끌올 1시간 전,판매중,골린,"G-three(G-three premium gold) 여성용 골프채 풀세트입니다 정품 보장 as가능 드라이버, 우드(4번), 유틸리티(U5), 아이언(6,7,8,9,P,A,S),  신품퍼터 (20만원상당)구성으로 풀세트입니다 샤프트는 퍼플 컬러의 DAIWA G-three premium gold 샤프트이며, 샤프트에 꽃무늬 디자인이 있어 세련된 느낌을 줍니다 전반적으로 사용감은 있으나, 클럽 헤드와 샤프트 상태는 양호합니다 루즈벨트 캐디백A급 연습장만사용했습니다 시타  교환가능 01046678106 전화주심  쿨네고",14,0,3,76,38.6°C,https://www.daangn.com/kr/buy-sell/%EB%8B%A4%EC%9D%B4%EC%99%80%EC%98%A8%EC%98%A4%ED%94%84g-three-%EC%97%AC%EC%84%B1-%EA%B3%A8%ED%94%84%EC%B1%84-%ED%92%80%EC%84%B8%ED%8A%B8-%EB%93%9C%EB%9D%BC%EC%9D%B4%EB%B2%84-%EC%9A%B0%EB%93%9C-%EC%9C%A0%ED%8B%B8-%EC%95%84%EC%9D%B4%EC%96%B8-%ED%8D%BC%ED%84%B0-6ijc21muz39m/
다이와온오프 여성골프세트,"899,000원",대전 대덕구 오정동,끌올 1시간 전,판매중,골린,골프채 풀세트 판매합니다. 다이와   드라이버  우드  유틸 다이와온오프 8아이언세트  일본제조   중국산 비교× 경량캐디백  미사용  미봉만했습니다 전체 그립 AAA급 입니다  신품급입니다 반달 퍼터 usa 01046678106 문자나  전화주세요 시간 맞음 시타도  가능합니다 전화주시고 쿨거래시   쿨네고,14,0,1,126,38.6°C,https://www.daangn.com/kr/buy-sell/%EB%8B%A4%EC%9D%B4%EC%99%80%EC%98%A8%EC%98%A4%ED%94%84-%EC%97%AC%EC%84%B1%EA%B3%A8%ED%94%84%EC%84%B8%ED%8A%B8-4r7h87gu9mja/
남성 골프채 풀세트 sr플렉스,"499,000원",대전 대덕구 오정동,끌올 1시간 전,판매중,골린,남성골프 클럽 풀세트 판매합니다! - 드라이버 우드 유틸 ㅡ 나이키 - 퍼터 - 아이언 구성   5  6  7  8 9 p  s  ㅡ 테일러메이드  정품   상태A급입니다 전체  그립  상태  좋습니다 샤프트 60r 이라서  50sr보다 단단합니다 사무실에  연습타석 작게  만들어 놓아서 시타도  가능합니다  비거리 측정도 가능요 비거리  짱짱하게 나와요 - 14구 골프백 포함 경량스탠드  직거래  선호  01046678106  전화주시고 쿨거래시  쿨네고 가능,11,0,0,266,38.6°C,https://www.daangn.com/kr/buy-sell/%EB%82%A8%EC%84%B1-%EA%B3%A8%ED%94%84%EC%B1%84-%ED%92%80%EC%84%B8%ED%8A%B8-sr%ED%94%8C%EB%A0%89%EC%8A%A4-6qdebft5k1uo/
